Killer name,Sex,Race,Number of victims,Date of birth,Birth order,Physically attractive?,Physical defect?,Speech defect?,Physically abused? ,Psychologically abused?,Sexually abused?Animal torture,Fire setting,Bed wetting,Abused drugs?,Abused alcohol?,Been to a psychologist (prior to killing)?,Time in forensic hospital (prior to killing)?,Diagnosis,Rape?,Tortured victims?,Overkill?,Quick & efficient?,Used blindfold?,Bound the victims?,Sex with the body?,Mutilated body?,Ate part of the body?,Drank victim’s blood?,Posed the body?,Took totem – body part,Took totem – personal item,Robbed victim or location,"Left at scene, no attempt to hide","Left at scene, hidden","Left at scene, buried","Moved, no attempt to hide","Moved, buried",Cut-op and disposed of,"Moved, too home"
Gary_Evans,Male,White,5 in 13 years and there is possibly more,October 7,2nd of 2,1,0,0,,1,,"YesHe set fire to Jennifer House Commons",Unknown,"NoHe hated people who did except for Lisa.  He believed drugdealers are no better than rapists or child molesters.","NoHe hated people who did except for Lisa.",,,Anti-Social Personality Disorder,0,0,1,1,0,1,0,1,0,0,0,0,0,1,1,0,1,0,1,,
