Killer name,Sex,Race,Number of victims,Date of birth,Birth order,Physically attractive?,Physical defect?,Speech defect?,Physically abused? ,Psychologically abused?,Sexually abused?Animal torture,Fire setting,Bed wetting,Abused drugs?,Abused alcohol?,Been to a psychologist (prior to killing)?,Time in forensic hospital (prior to killing)?,Diagnosis,Rape?,Tortured victims?,Overkill?,Quick & efficient?,Used blindfold?,Bound the victims?,Sex with the body?,Mutilated body?,Ate part of the body?,Drank victim’s blood?,Posed the body?,Took totem – body part,Took totem – personal item,Robbed victim or location,"Left at scene, no attempt to hide","Left at scene, hidden","Left at scene, buried","Moved, no attempt to hide","Moved, buried",Cut-op and disposed of,"Moved, too home"
Harvey_Donald_-_fall_2005,,,Harvey confessed to 87; however,April 15,1st of 3,"Yes – was always obsessed with his looks.  He even went tothe lengths of wearing dress clothes as a child to elementaryschool.",No,No,,Father called him feminine names.,,"Set a fire in a bathroom of an empty apartment in the buildingwhere he lived because he was depressed.",Unknown,"No – however did attempt suicide with over the counter drugsmultiple times.  Used Deseryl",No,,,Psychopathic-type personality disorder,No,No,No,"Usually – sometimes it would take a few days for the victimto die",No,No,No,No,No,Yes,No,No – however,Yes – for example: cookies,No,Yes,No,No,No,No,,No
