Killer name,Sex,Race,Number of victims,Date of birth,Birth order,Physically attractive?,Physical defect?,Speech defect?,Physically abused? ,Psychologically abused?,Sexually abused?Animal torture,Fire setting,Bed wetting,Abused drugs?,Abused alcohol?,Been to a psychologist (prior to killing)?,Time in forensic hospital (prior to killing)?,Diagnosis,Rape?,Tortured victims?,Overkill?,Quick & efficient?,Used blindfold?,Bound the victims?,Sex with the body?,Mutilated body?,Ate part of the body?,Drank victim’s blood?,Posed the body?,Took totem – body part,Took totem – personal item,Robbed victim or location,"Left at scene, no attempt to hide","Left at scene, hidden","Left at scene, buried","Moved, no attempt to hide","Moved, buried",Cut-op and disposed of,"Moved, too home"
Lindsey_William_Darrell_-_fall_2005,Male,White,7,3/18/1935,"Only child of natural parents.  Youngest of 4 in adoptivefamily",No,No,No,,Yes,,Set fire to a hut that local boys had built,No,"Abused Heroin in the ‘60s and store the pain pills fromhis second wife while she was battling cancer","Yes; abuse started after heavy drinking began once hejoined the National Guard",,,Sociopath,Yes,Usually post-mortem,No,Yes,Sometimes,Sometimes,N/A,Usually post-mortem,No,No,Yes,No,No,No,Sometimes posed. He wanted them to be seen,Yes,"Most of the bodies were either left in water or left to beseen by all",Yes,Yes,,No
