Killer name,Sex,Race,Number of victims,Date of birth,Birth order,Physically attractive?,Physical defect?,Speech defect?,Physically abused? ,Psychologically abused?,Sexually abused?Animal torture,Fire setting,Bed wetting,Abused drugs?,Abused alcohol?,Been to a psychologist (prior to killing)?,Time in forensic hospital (prior to killing)?,Diagnosis,Rape?,Tortured victims?,Overkill?,Quick & efficient?,Used blindfold?,Bound the victims?,Sex with the body?,Mutilated body?,Ate part of the body?,Drank victim’s blood?,Posed the body?,Took totem – body part,Took totem – personal item,Robbed victim or location,"Left at scene, no attempt to hide","Left at scene, hidden","Left at scene, buried","Moved, no attempt to hide","Moved, buried",Cut-op and disposed of,"Moved, too home"
Starrett_Danny__spring_2007_,Male,White,1 killed,September 25,Either 2nd or 3rd,Fairly,None documented,Yes,,"Not by anyone other than himself. Danny was very hard onhimself as a child.",,None documented,None documented,None documented,Yes,,,"Possible Atypical Paraphilia and possible MultiplePersonality Disorder",Yes,"Chained two victims at the ankle and placed them in hiscloset on separate occasions",No,Yes,"Put tape over one victims (Jeannie) sunglasses so she was notable to see where she was being held",Yes,"Oral and vaginal smears during autopsy showed positive forsemen (not clear if pre or post kill)",No,No,No,No,No,No,No,No,No,No,"Danny wrapped Jean McCrea’s body in a green blanket andtrash bags before dumping her into a creek bed near her homeof Irmo",No,No,
